title,view_count,publish_date
5 AI Tools That Will Replace Your Job in 2026,185000,2026-01-05T15:00:00Z
I Tried the New ChatGPT Update for a Week,38000,2026-01-08T15:00:00Z
Why Is Everyone Switching to This New AI Model?,142000,2026-01-12T15:00:00Z
This AI Can Code Better Than You,52000,2026-01-15T15:00:00Z
7 Ways to Use AI to Save 10 Hours a Week,210000,2026-01-19T15:00:00Z
My Honest Thoughts on the Latest AI News,21000,2026-01-22T15:00:00Z
Is This the Future of AI Video?,98000,2026-01-26T15:00:00Z
AI News Update,15000,2026-01-29T15:00:00Z
10 AI Predictions for 2026 That Will Blow Your Mind,250000,2026-02-02T15:00:00Z
A Quick Look at New AI Features,18000,2026-02-05T15:00:00Z
What Happens When AI Writes Its Own Code?,130000,2026-02-09T15:00:00Z
Reviewing AI Tools,12000,2026-02-12T15:00:00Z
3 AI Startups You Need to Watch in 2026,175000,2026-02-16T15:00:00Z
Daily AI News Roundup,9000,2026-02-19T15:00:00Z
Can AI Really Replace Programmers? Let's Find Out,165000,2026-02-23T15:00:00Z
How I Built an App Using Only AI in 24 Hours,220000,2026-03-02T15:00:00Z
